Sheet: primes
A1: 0 | B1: 0 | C1: 0 | D1: 0
A2: 500 | B2: 0.285714285714286 | C2: 0.142857142857143 | D2: 3
A3: 1000 | B3: 0.714285714285714 | C3: 0.285714285714286 | D3: 7.28571428571429
A4: 1500 | B4: 1 | C4: 0.857142857142857 | D4: 13.2857142857143
A5: 2000 | B5: 1.42857142857143 | C5: 1.42857142857143 | D5: 21
A6: 2500 | B6: 1.57142857142857 | C6: 2.14285714285714 | D6: 30.1428571428571
A7: 3000 | B7: 2 | C7: 3 | D7: 38.8571428571429
A8: 3500 | B8: 3.14285714285714 | C8: 3.42857142857143 | D8: 47.5714285714286
A9: 4000 | B9: 3.71428571428571 | C9: 4 | D9: 58.1428571428571
A10: 4500 | B10: 4.28571428571429 | C10: 4.85714285714286 | D10: 68.4285714285714
A11: 5000 | B11: 4.85714285714286 | C11: 6.57142857142857 | D11: 82.1428571428571
A12: 5500 | B12: 5.71428571428571 | C12: 7 | D12: 95
A13: 6000 | B13: 6.57142857142857 | C13: 8.14285714285714 | D13: 108.285714285714
A14: 6500 | B14: 6.85714285714286 | C14: 8.71428571428571 | D14: 120.428571428571
A15: 7000 | B15: 8 | C15: 10 | D15: 140.857142857143
A16: 7500 | B16: 9 | C16: 11.1428571428571 | D16: 156
A17: 8000 | B17: 10.1428571428571 | C17: 12.2857142857143 | D17: 183.285714285714
A18: 8500 | B18: 11.4285714285714 | C18: 12.7142857142857 | D18: 190.714285714286
A19: 9000 | B19: 12 | C19: 14 | D19: 205.571428571429
A20: 9500 | B20: 12.7142857142857 | C20: 15.2857142857143 | D20: 216.857142857143
A21: 10000 | B21: 13.7142857142857 | C21: 17.5714285714286 | D21: 240.571428571429

Sheet: nops
A1: 0 | B1: of:=[.$D1]*[.B$23]*(RAND()*0.1+0.95) -> 0 | C1: of:=[.$D1]*[.C$23]*(RAND()*0.1+0.95) -> 0 | D1: 0
A2: 5000 | B2: of:=[.$D2]*[.B$23]*(RAND()*0.1+0.95) -> 595.424176820422 | C2: of:=[.$D2]*[.C$23]*(RAND()*0.1+0.95) -> 76.9786745837821 | D2: 0.916666666666667
A3: 10000 | B3: of:=[.$D3]*[.B$23]*(RAND()*0.1+0.95) -> 859.053407033974 | C3: of:=[.$D3]*[.C$23]*(RAND()*0.1+0.95) -> 118.578878358501 | D3: 1.41666666666667
A4: 15000 | B4: of:=[.$D4]*[.B$23]*(RAND()*0.1+0.95) -> 1532.30473476954 | C4: of:=[.$D4]*[.C$23]*(RAND()*0.1+0.95) -> 191.089656214675 | D4: 2.41666666666667
A5: 20000 | B5: of:=[.$D5]*[.B$23]*(RAND()*0.1+0.95) -> 2059.05348675889 | C5: of:=[.$D5]*[.C$23]*(RAND()*0.1+0.95) -> 250.164570968642 | D5: 3.16666666666667
A6: 25000 | B6: of:=[.$D6]*[.B$23]*(RAND()*0.1+0.95) -> 2498.62429884778 | C6: of:=[.$D6]*[.C$23]*(RAND()*0.1+0.95) -> 325.085631484513 | D6: 3.91666666666667
A7: 30000 | B7: of:=[.$D7]*[.B$23]*(RAND()*0.1+0.95) -> 3130.90335690164 | C7: of:=[.$D7]*[.C$23]*(RAND()*0.1+0.95) -> 384.674204948927 | D7: 4.75
A8: 35000 | B8: of:=[.$D8]*[.B$23]*(RAND()*0.1+0.95) -> 3335.72109968455 | C8: of:=[.$D8]*[.C$23]*(RAND()*0.1+0.95) -> 450.194783716208 | D8: 5.25
A9: 40000 | B9: of:=[.$D9]*[.B$23]*(RAND()*0.1+0.95) -> 3657.38357492006 | C9: of:=[.$D9]*[.C$23]*(RAND()*0.1+0.95) -> 482.132995579603 | D9: 6
A10: 45000 | B10: of:=[.$D10]*[.B$23]*(RAND()*0.1+0.95) -> 4441.29574216499 | C10: of:=[.$D10]*[.C$23]*(RAND()*0.1+0.95) -> 539.523109339326 | D10: 6.83333333333333
A11: 50000 | B11: of:=[.$D11]*[.B$23]*(RAND()*0.1+0.95) -> 4837.37537952513 | C11: of:=[.$D11]*[.C$23]*(RAND()*0.1+0.95) -> 595.879489532327 | D11: 7.58333333333333
A12: 55000 | B12: of:=[.$D12]*[.B$23]*(RAND()*0.1+0.95) -> 5763.0907202383 | C12: of:=[.$D12]*[.C$23]*(RAND()*0.1+0.95) -> 734.465119527398 | D12: 8.75
A13: 60000 | B13: of:=[.$D13]*[.B$23]*(RAND()*0.1+0.95) -> 5575.19051900995 | C13: of:=[.$D13]*[.C$23]*(RAND()*0.1+0.95) -> 750.336781195368 | D13: 9.08333333333333
A14: 65000 | B14: of:=[.$D14]*[.B$23]*(RAND()*0.1+0.95) -> 5956.91374168327 | C14: of:=[.$D14]*[.C$23]*(RAND()*0.1+0.95) -> 808.786859093887 | D14: 9.75
A15: 70000 | B15: of:=[.$D15]*[.B$23]*(RAND()*0.1+0.95) -> 6657.20631401976 | C15: of:=[.$D15]*[.C$23]*(RAND()*0.1+0.95) -> 875.616836926669 | D15: 10.5
A16: 75000 | B16: of:=[.$D16]*[.B$23]*(RAND()*0.1+0.95) -> 7114.83017666785 | C16: of:=[.$D16]*[.C$23]*(RAND()*0.1+0.95) -> 910.142272566074 | D16: 11.5833333333333
A17: 80000 | B17: of:=[.$D17]*[.B$23]*(RAND()*0.1+0.95) -> 7268.9239009748 | C17: of:=[.$D17]*[.C$23]*(RAND()*0.1+0.95) -> 958.731946624804 | D17: 12
A18: 85000 | B18: of:=[.$D18]*[.B$23]*(RAND()*0.1+0.95) -> 8732.77845928172 | C18: of:=[.$D18]*[.C$23]*(RAND()*0.1+0.95) -> 1142.58714720016 | D18: 13.3333333333333
A19: 90000 | B19: of:=[.$D19]*[.B$23]*(RAND()*0.1+0.95) -> 8481.55092903947 | C19: of:=[.$D19]*[.C$23]*(RAND()*0.1+0.95) -> 1147.78842284688 | D19: 14
A20: 95000 | B20: of:=[.$D20]*[.B$23]*(RAND()*0.1+0.95) -> 9403.27580309764 | C20: of:=[.$D20]*[.C$23]*(RAND()*0.1+0.95) -> 1138.22401543932 | D20: 14.5
A21: 100000 | B21: of:=[.$D21]*[.B$23]*(RAND()*0.1+0.95) -> 9593.84156698541 | C21: of:=[.$D21]*[.C$23]*(RAND()*0.1+0.95) -> 1311.08606716552 | D21: 15.5
B23: of:=9850/15.6 -> 631.410256410257 | C23: 82.3

Sheet: convert
A1: 0 | B1: of:=[.E1]*[.B$22] -> 0 | C1: of:=[.F1]*[.C$22] -> 0 | E1: 0 | F1: 0
A2: 5000 | B2: of:=[.E2]*[.B$22] -> 3.57142857142858 | C2: of:=[.F2]*[.C$22] -> 4.5 | E2: 0.142857142857143 | F2: 3
A3: 10000 | B3: of:=[.E3]*[.B$22] -> 7.14285714285715 | C3: of:=[.F3]*[.C$22] -> 10.9285714285714 | E3: 0.285714285714286 | F3: 7.28571428571429
A4: 15000 | B4: of:=[.E4]*[.B$22] -> 21.4285714285714 | C4: of:=[.F4]*[.C$22] -> 19.9285714285715 | E4: 0.857142857142857 | F4: 13.2857142857143
A5: 20000 | B5: of:=[.E5]*[.B$22] -> 35.7142857142858 | C5: of:=[.F5]*[.C$22] -> 31.5 | E5: 1.42857142857143 | F5: 21
A6: 25000 | B6: of:=[.E6]*[.B$22] -> 53.5714285714285 | C6: of:=[.F6]*[.C$22] -> 45.2142857142857 | E6: 2.14285714285714 | F6: 30.1428571428571
A7: 30000 | B7: of:=[.E7]*[.B$22] -> 75 | C7: of:=[.F7]*[.C$22] -> 58.2857142857143 | E7: 3 | F7: 38.8571428571429
A8: 35000 | B8: of:=[.E8]*[.B$22] -> 85.7142857142858 | C8: of:=[.F8]*[.C$22] -> 71.3571428571429 | E8: 3.42857142857143 | F8: 47.5714285714286
A9: 40000 | B9: of:=[.E9]*[.B$22] -> 100 | C9: of:=[.F9]*[.C$22] -> 87.2142857142856 | E9: 4 | F9: 58.1428571428571
A10: 45000 | B10: of:=[.E10]*[.B$22] -> 121.428571428572 | C10: of:=[.F10]*[.C$22] -> 102.642857142857 | E10: 4.85714285714286 | F10: 68.4285714285714
A11: 50000 | B11: of:=[.E11]*[.B$22] -> 164.285714285714 | C11: of:=[.F11]*[.C$22] -> 123.214285714286 | E11: 6.57142857142857 | F11: 82.1428571428571
A12: 55000 | B12: of:=[.E12]*[.B$22] -> 175 | C12: of:=[.F12]*[.C$22] -> 142.5 | E12: 7 | F12: 95
A13: 60000 | B13: of:=[.E13]*[.B$22] -> 203.571428571429 | C13: of:=[.F13]*[.C$22] -> 162.428571428571 | E13: 8.14285714285714 | F13: 108.285714285714
A14: 65000 | B14: of:=[.E14]*[.B$22] -> 217.857142857143 | C14: of:=[.F14]*[.C$22] -> 180.642857142857 | E14: 8.71428571428571 | F14: 120.428571428571
A15: 70000 | B15: of:=[.E15]*[.B$22] -> 250 | C15: of:=[.F15]*[.C$22] -> 211.285714285715 | E15: 10 | F15: 140.857142857143
A16: 75000 | B16: of:=[.E16]*[.B$22] -> 278.571428571427 | C16: of:=[.F16]*[.C$22] -> 234 | E16: 11.1428571428571 | F16: 156
A17: 80000 | B17: of:=[.E17]*[.B$22] -> 307.142857142858 | C17: of:=[.F17]*[.C$22] -> 274.928571428571 | E17: 12.2857142857143 | F17: 183.285714285714
A18: 85000 | B18: of:=[.E18]*[.B$22] -> 317.857142857142 | C18: of:=[.F18]*[.C$22] -> 286.071428571429 | E18: 12.7142857142857 | F18: 190.714285714286
A19: 90000 | B19: of:=[.E19]*[.B$22] -> 350 | C19: of:=[.F19]*[.C$22] -> 308.357142857144 | E19: 14 | F19: 205.571428571429
A20: 95000 | B20: of:=[.E20]*[.B$22] -> 382.142857142858 | C20: of:=[.F20]*[.C$22] -> 325.285714285714 | E20: 15.2857142857143 | F20: 216.857142857143
A21: 100000 | B21: of:=[.E21]*[.B$22] -> 439.285714285715 | C21: of:=[.F21]*[.C$22] -> 360.857142857144 | E21: 17.5714285714286 | F21: 240.571428571429
B22: 25 | C22: 1.5

Sheet: render
A1: 5000 | B1: of:=([.C1]/[.B$22]*(RAND()*0.1+0.95)) -> 62.198323098099 | C1: of:=([.A1]*0.041 + [.A1]*[.A1] * 0.000000003 * PI()) * (RAND()*0.1+0.95) -> 203.912929656303
A2: 10000 | B2: of:=([.C2]/[.B$22]*(RAND()*0.1+0.95)) -> 132.671699391607 | C2: of:=([.A2]*0.041 + [.A2]*[.A2] * 0.000000003 * PI()) * (RAND()*0.1+0.95) -> 424.579783378641
A3: 15000 | B3: of:=([.C3]/[.B$22]*(RAND()*0.1+0.95)) -> 182.171554214501 | C3: of:=([.A3]*0.041 + [.A3]*[.A3] * 0.000000003 * PI()) * (RAND()*0.1+0.95) -> 614.772098663649
A4: 20000 | B4: of:=([.C4]/[.B$22]*(RAND()*0.1+0.95)) -> 242.864084598017 | C4: of:=([.A4]*0.041 + [.A4]*[.A4] * 0.000000003 * PI()) * (RAND()*0.1+0.95) -> 826.894890494725
A5: 25000 | B5: of:=([.C5]/[.B$22]*(RAND()*0.1+0.95)) -> 322.231396957676 | C5: of:=([.A5]*0.041 + [.A5]*[.A5] * 0.000000003 * PI()) * (RAND()*0.1+0.95) -> 1064.85911825977
A6: 30000 | B6: of:=([.C6]/[.B$22]*(RAND()*0.1+0.95)) -> 367.575942487181 | C6: of:=([.A6]*0.041 + [.A6]*[.A6] * 0.000000003 * PI()) * (RAND()*0.1+0.95) -> 1240.3811121119
A7: 35000 | B7: of:=([.C7]/[.B$22]*(RAND()*0.1+0.95)) -> 464.335807327404 | C7: of:=([.A7]*0.041 + [.A7]*[.A7] * 0.000000003 * PI()) * (RAND()*0.1+0.95) -> 1470.77190038785
A8: 40000 | B8: of:=([.C8]/[.B$22]*(RAND()*0.1+0.95)) -> 491.549500369442 | C8: of:=([.A8]*0.041 + [.A8]*[.A8] * 0.000000003 * PI()) * (RAND()*0.1+0.95) -> 1639.65470182759
A9: 45000 | B9: of:=([.C9]/[.B$22]*(RAND()*0.1+0.95)) -> 577.933138340573 | C9: of:=([.A9]*0.041 + [.A9]*[.A9] * 0.000000003 * PI()) * (RAND()*0.1+0.95) -> 1939.28984575117
A10: 50000 | B10: of:=([.C10]/[.B$22]*(RAND()*0.1+0.95)) -> 649.488250549178 | C10: of:=([.A10]*0.041 + [.A10]*[.A10] * 0.000000003 * PI()) * (RAND()*0.1+0.95) -> 2046.58080458565
A11: 55000 | B11: of:=([.C11]/[.B$22]*(RAND()*0.1+0.95)) -> 671.951867719571 | C11: of:=([.A11]*0.041 + [.A11]*[.A11] * 0.000000003 * PI()) * (RAND()*0.1+0.95) -> 2193.34732403544
A12: 60000 | B12: of:=([.C12]/[.B$22]*(RAND()*0.1+0.95)) -> 746.959813694173 | C12: of:=([.A12]*0.041 + [.A12]*[.A12] * 0.000000003 * PI()) * (RAND()*0.1+0.95) -> 2459.85941829315
A13: 65000 | B13: of:=([.C13]/[.B$22]*(RAND()*0.1+0.95)) -> 840.82361417382 | C13: of:=([.A13]*0.041 + [.A13]*[.A13] * 0.000000003 * PI()) * (RAND()*0.1+0.95) -> 2741.63464346979
A14: 70000 | B14: of:=([.C14]/[.B$22]*(RAND()*0.1+0.95)) -> 879.144564913665 | C14: of:=([.A14]*0.041 + [.A14]*[.A14] * 0.000000003 * PI()) * (RAND()*0.1+0.95) -> 2860.86394325561
A15: 75000 | B15: of:=([.C15]/[.B$22]*(RAND()*0.1+0.95)) -> 936.377012786166 | C15: of:=([.A15]*0.041 + [.A15]*[.A15] * 0.000000003 * PI()) * (RAND()*0.1+0.95) -> 2981.89137672989
A16: 80000 | B16: of:=([.C16]/[.B$22]*(RAND()*0.1+0.95)) -> 1010.64857763444 | C16: of:=([.A16]*0.041 + [.A16]*[.A16] * 0.000000003 * PI()) * (RAND()*0.1+0.95) -> 3410.34421306399
A17: 85000 | B17: of:=([.C17]/[.B$22]*(RAND()*0.1+0.95)) -> 1125.77853832811 | C17: of:=([.A17]*0.041 + [.A17]*[.A17] * 0.000000003 * PI()) * (RAND()*0.1+0.95) -> 3727.46953377661
A18: 90000 | B18: of:=([.C18]/[.B$22]*(RAND()*0.1+0.95)) -> 1190.01360284543 | C18: of:=([.A18]*0.041 + [.A18]*[.A18] * 0.000000003 * PI()) * (RAND()*0.1+0.95) -> 3894.31386441189
A19: 95000 | B19: of:=([.C19]/[.B$22]*(RAND()*0.1+0.95)) -> 1186.48954522394 | C19: of:=([.A19]*0.041 + [.A19]*[.A19] * 0.000000003 * PI()) * (RAND()*0.1+0.95) -> 4073.57323195195
A20: 100000 | B20: of:=([.C20]/[.B$22]*(RAND()*0.1+0.95)) -> 1273.65909691156 | C20: of:=([.A20]*0.041 + [.A20]*[.A20] * 0.000000003 * PI()) * (RAND()*0.1+0.95) -> 4079.87976651345
B22: 3.3